,job_title,publish,company,city,description,link,website,date,search_title
0,Data Engineer (m/w/d) - hybrid,Vor 11 Stunden,AIM - Agile IT Management GmbH,Osnabrück,Vollzeit | unbefristet | Osnabrück | hybrid Als Data Engineer (m/w/d) bei AIM schaffst du durch deine Datenaufbereitung die Grundlage für die Analyseprojekte deiner,https://www.xing.com/jobs/osnabrueck-data-engineer-hybrid-101112768,xing,2023-05-05 12:18:17,Data Engineer
1,Professur für »Bauinformatik im konstruktiven Ingenieurbau« im Fachbereich Bauingenieurwesen (m/w/d),Vor 13 Stunden,FH Münster,Münster,"Monitoring, Big Data sowie nachhaltige und digitale Bauwerksüberwachung.",https://www.xing.com/jobs/muenster-professur-bauinformatik-konstruktiven-ingenieurbau-fachbereich-bauingenieurwesen-100110435,xing,2023-05-05 12:18:17,Data Engineer
2,Data Engineer (m/w/d),Vor 19 Stunden,ISR Information Products AG,Münster,Du setzt kundenindividuelle Lösungen mit Big Data und Public Cloud Technologien um. Du wirkst bei Lösungsarchitekturen und der Herstellung von Deployments mit.,https://www.xing.com/jobs/muenster-data-engineer-101094543,xing,2023-05-05 12:18:17,Data Engineer
3,Security Engineer Endpoint Protection (m/w/d),Vor 21 Stunden,pco GmbH & Co. KG,Osnabrück,"Gute Kenntnisse der Produkte Data Loss Prevention, AntiVirus, Desktop Firewall und Host Intrusion Prevention.",https://www.xing.com/jobs/osnabrueck-security-engineer-endpoint-protection-101091780,xing,2023-05-05 12:18:17,Data Engineer
4,Application Engineer-Controls for Data Centers (male/female/x),Gestern,FläktGroup Deutschland GmbH,Herne,We are looking for an Application Engineer for Data Centers (male/female/x) MAIN RESPONSIBILITIES • Planning / project planning of electrical engineering systems,https://www.xing.com/jobs/herne-application-engineer-controls-data-centers-male-female-101087069,xing,2023-05-05 12:18:17,Data Engineer
5,Testingenieur (m/w/d) Function & Safety,Gestern,ZF Group,Stemwede,"Stellensegment: R&D Engineer, Systems Engineer, R&D, Safety, Engineer, Engineering, Research, Service",https://www.xing.com/jobs/stemwede-testingenieur-function-safety-101063597,xing,2023-05-05 12:18:17,Data Engineer
6,Head of Data Engineering,Gestern,Symrise AG,Holzminden,on when necessary Technical Degree such as (business) computer scientist or (business) engineer or comparable education Experience managing or leading other data,https://www.xing.com/jobs/holzminden-head-data-engineering-101063465,xing,2023-05-05 12:18:17,Data Engineer
7,"DevOps Engineer | Big Data, LINUX, DevOps, JAVA, Cloud | bis 100% Home-Office mögl. (mwd)",Gestern,Vesterling AG,Dortmund,Als DevOps Engineer leisten Sie hier Beratung in Kundenprojekten bei einem innovativem Start-up.,https://www.xing.com/jobs/dortmund-devops-engineer-big-data-linux-devops-java-cloud-100-home-office-moegl-mwd-101053237,xing,2023-05-05 12:18:17,Data Engineer
8,"APEX / ORACLE Software Developer | Forms, Reports, Implementierung | Home-Office möglich (mwd)",Vor 2 Tagen,Vesterling AG,Bochum,"In deinem Team aus Softwareentwickler:innen, POs, Data Scientists und Expert:innen im Bereich UX/UI-Design und -Entwicklung übernimmst du die DevOps-Aufgaben.",https://www.xing.com/jobs/bochum-apex-oracle-software-developer-forms-reports-implementierung-home-office-mwd-101052181,xing,2023-05-05 12:18:17,Data Engineer
9,"APEX / ORACLE Software Developer | Forms, Reports, Implementierung | Home-Office möglich (mwd)",Vor 2 Tagen,Vesterling AG,Dortmund,"Sie installieren, konfigurieren und monitoren BI/Big Data Anwendungen.",https://www.xing.com/jobs/dortmund-apex-oracle-software-developer-forms-reports-implementierung-home-office-mwd-101052183,xing,2023-05-05 12:18:17,Data Engineer
10,DevOps Engineer - Industrielle KI (m/w/d),Vor 2 Tagen,AIM - Agile IT Management GmbH,Osnabrück,"Sie installieren, konfigurieren und monitoren BI/Big Data Anwendungen.",https://www.xing.com/jobs/osnabrueck-devops-engineer-industrielle-ki-101051068,xing,2023-05-05 12:18:17,Data Engineer
11,"SAS Administrator | SAS Analytics Software, Linux, Java-Stack, Big Data | Inhouse (mwd)",Vor 2 Tagen,Vesterling AG,Paderborn,Als Linux Systems Engineer betreiben Sie bei einem etablierten IT-Beratungshaus Lösungen für SAS Business Intelligence und Big Data.,https://www.xing.com/jobs/paderborn-sas-administrator-sas-analytics-software-linux-java-stack-big-data-inhouse-mwd-101048205,xing,2023-05-05 12:18:17,Data Engineer
12,"SAS Administrator | SAS Analytics Software, Linux, Java-Stack, Big Data | Inhouse (mwd)",Vor 2 Tagen,Vesterling AG,Dortmund,Als Linux Systems Engineer betreiben Sie bei einem etablierten IT-Beratungshaus Lösungen für SAS Business Intelligence und Big Data.,https://www.xing.com/jobs/dortmund-sas-administrator-sas-analytics-software-linux-java-stack-big-data-inhouse-mwd-101048201,xing,2023-05-05 12:18:17,Data Engineer
13,"Linux-Systemadministrator | Anwendungsbetrieb im Java-Umfeld, BI, Big Data (mwd)",Vor 2 Tagen,Vesterling AG,Dortmund,"oder einer vergleichbar geeigneten Fachrichtung Interesse oder Berufserfahrung im Bereich der IT-Security Themen wie Firewalls, Antivirus / Antispam, IDS / IPS, Data",https://www.xing.com/jobs/dortmund-linux-systemadministrator-anwendungsbetrieb-java-umfeld-bi-big-data-mwd-101048194,xing,2023-05-05 12:18:17,Data Engineer
14,"Linux-Systemadministrator | Anwendungsbetrieb im Java-Umfeld, BI, Big Data (mwd)",Vor 2 Tagen,Vesterling AG,Paderborn,Als Data Engineer (m/w/d) bei der inserve schaffst du durch deine Datenaufbereitung die Grundlage für die Analyseprojekte deiner Teammitglieder und stellst so den,https://www.xing.com/jobs/paderborn-linux-systemadministrator-anwendungsbetrieb-java-umfeld-bi-big-data-mwd-101048189,xing,2023-05-05 12:18:17,Data Engineer
15,"IT Security Engineer | Linux, Windows | bis. 80.000€ p.a. | 100% Home-Office mögl. (mwd)",Vor 2 Tagen,Vesterling AG,Dortmund,"KVM und Container-Technologien (Docker, LXC) Erfahrungen und Kenntnisse im Cloud-affinen skalierten Produktivbetrieb für Software-Entwicklung, AI-Modelling, Big Data",https://www.xing.com/jobs/dortmund-it-security-engineer-linux-windows-80-000-100-home-office-moegl-mwd-101047805,xing,2023-05-05 12:18:17,Data Engineer
16,Data Engineer (m/w/d),Vor 2 Tagen,inserve GmbH,Osnabrück,Deine Aufgaben Data und AI sind dein zu Hause?,https://www.xing.com/jobs/osnabrueck-data-engineer-101038139,xing,2023-05-05 12:18:17,Data Engineer
17,"DevOps Profi | LINUX, Docker, Kubernetes, ansible, puppet | Inhouse, bis 90 T€ (mwd)",Vor 2 Tagen,Vesterling AG,Dortmund,"Mind. 2 Jahre Berufserfahrung als Software Engineer, Softwareentwickler:in, Data Engineer oder ähnlichem Berufsfeld Sehr gute Kenntnisse der Programmiersprachen",https://www.xing.com/jobs/dortmund-devops-profi-linux-docker-kubernetes-ansible-puppet-inhouse-90-mwd-101025805,xing,2023-05-05 12:18:17,Data Engineer
18,Data Visualization Engineer - Fokus Qlik (m/w/d),Vor 2 Tagen,Alexander Thamm GmbH,Allendorf,,https://www.xing.com/jobs/allendorf-data-visualization-engineer-fokus-qlik-101023087,xing,2023-05-05 12:18:17,Data Engineer
19,Data Engineer (m/w/d),Vor 2 Tagen,Alexander Thamm GmbH,Allendorf,,https://www.xing.com/jobs/allendorf-data-engineer-101023092,xing,2023-05-05 12:18:17,Data Engineer
